{
  "$schema": "../../schema/scenario.schema.json",
  "id": "sample",
  "title": "갈림길 예시",
  "question": "만약 이 지점에서 역사가 다르게 흘렀다면? (자리표시)",
  "summary": "틀이 제대로 도는지 확인하기 위한 예시입니다. 모든 내용은 자리표시이며 역사적 주장이 아닙니다.",
  "status": "sample",
  "anchor": {
    "entry": "korea-goryeo",
    "year": 918,
    "note": "자리표시 — 여기에는 이 지점에서 실제로 일어난 일을 한두 문장으로 적습니다."
  },
  "compare": ["korea", "china", "japan"],
  "start": "fork-1",
  "nodes": [
    {
      "id": "fork-1",
      "kind": "choice",
      "year": 918,
      "title": "첫 번째 갈림길",
      "text": "자리표시 — 갈림길의 상황 설명이 들어갑니다.",
      "options": [
        { "label": "선택지 A (정해진 결과)", "to": "a-1" },
        {
          "label": "선택지 B (확률로 갈림)",
          "outcomes": [
            { "chance": 0.7, "to": "b-1", "label": "흔한 결과" },
            { "chance": 0.3, "to": "b-2", "label": "드문 결과" }
          ]
        }
      ]
    },
    {
      "id": "a-1",
      "kind": "event",
      "year": 950,
      "end_year": 990,
      "title": "가상 사건 A-1",
      "text": "자리표시 — 선택지 A 뒤에 이어지는 가상 사건입니다.",
      "next": "fork-2"
    },
    {
      "id": "fork-2",
      "kind": "choice",
      "year": 1010,
      "title": "두 번째 갈림길",
      "text": "자리표시 — 갈림길 안의 갈림길입니다.",
      "options": [
        { "label": "선택지 A-가", "to": "end-a1" },
        { "label": "선택지 A-나", "to": "end-a2" }
      ]
    },
    {
      "id": "end-a1",
      "kind": "ending",
      "year": 1100,
      "title": "결말 A-가",
      "text": "자리표시 — 결말 설명이 들어갑니다.",
      "reality": "자리표시 — 실제로는 어떻게 되었는지 비교해 적는 곳입니다."
    },
    {
      "id": "end-a2",
      "kind": "ending",
      "year": 1150,
      "title": "결말 A-나",
      "text": "자리표시 — 결말 설명이 들어갑니다.",
      "reality": "자리표시 — 실제로는 어떻게 되었는지 비교해 적는 곳입니다."
    },
    {
      "id": "b-1",
      "kind": "event",
      "year": 940,
      "title": "가상 사건 B-1 (흔한 결과)",
      "text": "자리표시 — 70% 확률로 나오는 결과입니다.",
      "next": "end-b1"
    },
    {
      "id": "b-2",
      "kind": "event",
      "year": 945,
      "end_year": 980,
      "title": "가상 사건 B-2 (드문 결과)",
      "text": "자리표시 — 30% 확률로 나오는 결과입니다.",
      "next": "end-b2"
    },
    {
      "id": "end-b1",
      "kind": "ending",
      "year": 1050,
      "title": "결말 B-1",
      "text": "자리표시 — 결말 설명이 들어갑니다.",
      "reality": "자리표시 — 실제로는 어떻게 되었는지 비교해 적는 곳입니다."
    },
    {
      "id": "end-b2",
      "kind": "ending",
      "year": 1080,
      "title": "결말 B-2",
      "text": "자리표시 — 결말 설명이 들어갑니다.",
      "reality": "자리표시 — 실제로는 어떻게 되었는지 비교해 적는 곳입니다."
    }
  ]
}
